"Package","Version","Description","description_btw"
"magrittr","2.0.4","Provides a mechanism for chaining commands with a new
forward-pipe operator, %>%. This operator will forward a value, or the
result of an expression, into the next function call/expression.
There is flexible support for the type of right-hand side expressions.
For more information, see package vignette.  To quote Rene Magritte,
""Ceci n'est pas un pipe.""","This package introduces a forward-pipe operator, %>%, which allows for chaining commands by passing the result of one expression directly into the next function call, enabling more readable and efficient code."
"MASS","7.3-65","Functions and datasets to support Venables and Ripley,
""Modern Applied Statistics with S"" (4th edition, 2002).","The package provides functions and datasets designed to support the examples and methodologies presented in the fourth edition of Venables and Ripley's ""Modern Applied Statistics with S."""
"Matrix","1.7-4","A rich hierarchy of sparse and dense matrix classes,
including general, symmetric, triangular, and diagonal matrices
with numeric, logical, or pattern entries.  Efficient methods for
operating on such matrices, often wrapping the 'BLAS', 'LAPACK',
and 'SuiteSparse' libraries.","This package provides a comprehensive set of classes and efficient methods for manipulating a variety of sparse and dense matrices, including general, symmetric, triangular, and diagonal structures, leveraging advanced libraries such as 'BLAS', 'LAPACK', and 'SuiteSparse'."
"memoise","2.0.1","Cache the results of a function so that when you
call it again with the same arguments it returns the previously computed
value.","This package provides a caching mechanism for functions, allowing them to return previously computed results when called with the same arguments."
"metacore","0.2.1","Create an immutable container holding metadata for the
purpose of better enabling programming activities and functionality of
other packages within the clinical programming workflow.","This package provides an immutable container for metadata to enhance programming activities and improve the functionality of other packages in the clinical programming workflow."
"metatools","0.2.0","Uses the metadata information stored in 'metacore' objects to
check and build metadata associated columns.","This package utilizes metadata information from 'metacore' objects to verify and construct associated metadata columns."
"mgcv","1.9-3","Generalized additive (mixed) models, some of their extensions and
other generalized ridge regression with multiple smoothing
parameter estimation by (Restricted) Marginal Likelihood,
Generalized Cross Validation and similar, or using iterated
nested Laplace approximation for fully Bayesian inference. See
Wood (2017) <doi:10.1201/9781315370279> for an overview.
Includes a gam() function, a wide variety of smoothers, 'JAGS'
support and distributions beyond the exponential family.","This package facilitates the implementation of generalized additive (mixed) models with multiple smoothing parameter estimation methods, providing tools for both frequentist and Bayesian inference, along with support for various smoothers and distributions."
"mvtnorm","1.3-3","Computes multivariate normal and t probabilities, quantiles, random deviates,
and densities. Log-likelihoods for multivariate Gaussian models and Gaussian copulae
parameterised by Cholesky factors of covariance or precision matrices are implemented
for interval-censored and exact data, or a mix thereof. Score functions for these
log-likelihoods are available. A class representing multiple lower triangular matrices
and corresponding methods are part of this package.","This package facilitates the computation of multivariate normal and t probabilities, quantiles, random variates, densities, and log-likelihoods for multivariate Gaussian models and Gaussian copulae using Cholesky factors, while also providing score functions and support for interval-censored and exact data."
"nlme","3.1-168","Fit and compare Gaussian linear and nonlinear mixed-effects models.","This package provides tools for fitting and comparing both Gaussian linear and nonlinear mixed-effects models for analyzing complex data structures with hierarchical relationships."
"numDeriv","2016.8-1.1","Methods for calculating (usually) accurate
numerical first and second order derivatives. Accurate calculations
are done using 'Richardson''s' extrapolation or, when applicable, a
complex step derivative is available. A simple difference
method is also provided. Simple difference is (usually) less accurate
but is much quicker than 'Richardson''s' extrapolation and provides a
useful cross-check.
Methods are provided for real scalar and vector valued functions.","This package provides methods for accurately calculating first and second order numerical derivatives of functions using Richardson's extrapolation, complex step derivatives, and simple difference methods for both real scalar and vector-valued functions."
"patchwork","1.3.2","The 'ggplot2' package provides a strong API for sequentially
building up a plot, but does not concern itself with composition of multiple
plots. 'patchwork' is a package that expands the API to allow for
arbitrarily complex composition of plots by, among others, providing
mathematical operators for combining multiple plots. Other packages that try
to address this need (but with a different approach) are 'gridExtra' and
'cowplot'.","The 'patchwork' package allows users to easily compose and combine multiple 'ggplot2' plots into complex layouts using simple mathematical operators."
"pharmaRTF","0.1.4","Enhanced RTF wrapper written in R for use with existing R tables
packages such as 'Huxtable' or 'GT'. This package fills a gap where tables in
certain packages can be written out to RTF, but cannot add certain metadata
or features to the document that are required/expected in a report for a
regulatory submission, such as multiple levels of titles and footnotes,
making the document landscape, and controlling properties such as margins.","This R package provides an enhanced RTF wrapper that allows users to create RTF documents with advanced features such as multiple title levels, footnotes, landscape orientation, and customizable margins, facilitating the generation of regulatory report-ready tables from existing R packages like 'Huxtable' and 'GT'."
"pillar","1.11.1","Provides 'pillar' and 'colonnade' generics designed
for formatting columns of data using the full range of colours
provided by modern terminals.","This package offers generics for formatting data columns with a wide array of colors suitable for modern terminal displays, utilizing 'pillar' and 'colonnade' functionalities."
"pkgbuild","1.4.8","Provides functions used to build R packages. Locates
compilers needed to build R packages on various platforms and ensures
the PATH is configured appropriately so R can use them.","This package provides essential functions for building R packages, including locating necessary compilers across different platforms and configuring the PATH for R to utilize them effectively."
"pkgconfig","2.0.3","Set configuration options on a per-package basis.
Options set by a given package only apply to that package,
other packages are unaffected.","This package allows users to configure options that apply specifically to individual packages, ensuring that settings for one package do not affect others."
"pkgload","1.4.1","Simulates the process of installing a package and then
attaching it. This is a key part of the 'devtools' package as it
allows you to rapidly iterate while developing a package.","The package facilitates the rapid simulation of installing and attaching R packages, enabling efficient iteration during the development process."
"prettyunits","1.2.0","Pretty, human readable formatting of quantities.
Time intervals: '1337000' -> '15d 11h 23m 20s'.
Vague time intervals: '2674000' -> 'about a month ago'.
Bytes: '1337' -> '1.34 kB'.
Rounding: '99' with 3 significant digits -> '99.0'
p-values: '0.00001' -> '<0.0001'.
Colors: '#FF0000' -> 'red'.
Quantities: '1239437' -> '1.24 M'.","This package provides human-readable formatting for various quantities, including time intervals, byte sizes, and numerical values, enhancing the clarity of data presentation in R."
"processx","3.8.6","Tools to run system processes in the background.  It can
check if a background process is running; wait on a background process
to finish; get the exit status of finished processes; kill background
processes. It can read the standard output and error of the processes,
using non-blocking connections. 'processx' can poll a process for
standard output or error, with a timeout. It can also poll several
processes at once.","The 'processx' package provides tools for managing and interacting with system processes in the background, allowing users to check the status, wait for completion, retrieve exit statuses, read output and error streams, and handle multiple processes simultaneously."
"progress","1.2.3","Configurable Progress bars, they may include percentage,
elapsed time, and/or the estimated completion time. They work in
terminals, in 'Emacs' 'ESS', 'RStudio', 'Windows' 'Rgui' and the
'macOS' 'R.app'. The package also provides a 'C++' 'API', that works
with or without 'Rcpp'.","This package offers configurable progress bars compatible with various environments, displaying features like percentage, elapsed time, and estimated completion time, along with a C++ API that functions with or without Rcpp."
"ps","1.9.1","List, query and manipulate all system processes, on
'Windows', 'Linux' and 'macOS'.","This package allows users to list, query, and manipulate all system processes on Windows, Linux, and macOS platforms."
"purrr","1.2.0","A complete and consistent functional programming toolkit for
R.","This package provides a comprehensive and cohesive set of tools for functional programming in R, enabling users to write cleaner and more efficient code."
"r2rtf","1.2.0","Create production-ready Rich Text Format (RTF) tables and figures
with flexible format.","This package allows users to create production-ready Rich Text Format (RTF) tables and figures with flexible formatting options."
"R6","2.6.1","Creates classes with reference semantics, similar to R's
built-in reference classes. Compared to reference classes, R6 classes
are simpler and lighter-weight, and they are not built on S4 classes
so they do not require the methods package. These classes allow public
and private members, and they support inheritance, even when the
classes are defined in different packages.","The R6 package facilitates the creation of lightweight reference classes in R with support for public and private members and inheritance, without the complexities of S4 classes."
"RColorBrewer","1.1-3","Provides color schemes for maps (and other graphics)
designed by Cynthia Brewer as described at http://colorbrewer2.org.","This package offers a variety of color schemes for maps and graphics, designed by Cynthia Brewer, as detailed on the ColorBrewer website."
"Rcpp","1.1.0","The 'Rcpp' package provides R functions as well as C++ classes which
offer a seamless integration of R and C++. Many R data types and objects can be
mapped back and forth to C++ equivalents which facilitates both writing of new
code as well as easier integration of third-party libraries. Documentation
about 'Rcpp' is provided by several vignettes included in this package, via the
'Rcpp Gallery' site at <https://gallery.rcpp.org>, the paper by Eddelbuettel and
Francois (2011, <doi:10.18637/jss.v040.i08>), the book by Eddelbuettel (2013,
<doi:10.1007/978-1-4614-6868-4>) and the paper by Eddelbuettel and Balamuta (2018,
<doi:10.1080/00031305.2017.1375990>); see 'citation(""Rcpp"")' for details.","The 'Rcpp' package facilitates seamless integration between R and C++ by providing R functions and C++ classes that enable efficient data type mapping and code interoperability."
"readr","2.1.5","The goal of 'readr' is to provide a fast and friendly way to
read rectangular data (like 'csv', 'tsv', and 'fwf').  It is designed
to flexibly parse many types of data found in the wild, while still
cleanly failing when data unexpectedly changes.","The 'readr' package in R offers a fast and user-friendly approach to reading rectangular data formats such as CSV, TSV, and FWF, with flexible parsing capabilities and robust error handling for unexpected data changes."
"readxl","1.4.5","Import excel files into R. Supports '.xls' via the embedded
'libxls' C library <https://github.com/libxls/libxls> and '.xlsx' via
the embedded 'RapidXML' C++ library <https://rapidxml.sourceforge.net/>.
Works on Windows, Mac and Linux without external dependencies.","This package allows the import of Excel files (.xls and .xlsx) into R, providing cross-platform support without the need for external dependencies."
"rematch","2.0.0","A small wrapper on 'regexpr' to extract the matches and
captured groups from the match of a regular expression to a character
vector.","This package provides a simplified interface to the `regexpr` function, allowing users to extract matches and captured groups from regular expressions applied to character vectors."
"renv","1.1.5","A dependency management toolkit for R. Using 'renv', you can create
and manage project-local R libraries, save the state of these libraries to
a 'lockfile', and later restore your library as required. Together, these
tools can help make your projects more isolated, portable, and reproducible.","`renv` is a dependency management toolkit for R that facilitates the creation and management of project-local R libraries, allowing users to save and restore library states for enhanced isolation, portability, and reproducibility of their projects."
"rlang","1.1.6","A toolbox for working with base types, core R features
like the condition system, and core 'Tidyverse' features like tidy
evaluation.","This package provides a toolkit for utilizing base types and core R functionalities, including the condition system and Tidyverse features such as tidy evaluation."
"roxygen2","7.3.3","Generate your Rd documentation, 'NAMESPACE' file, and
collation field using specially formatted comments. Writing
documentation in-line with code makes it easier to keep your
documentation up-to-date as your requirements change. 'roxygen2' is
inspired by the 'Doxygen' system for C++.","The 'roxygen2' package in R allows users to generate documentation, a 'NAMESPACE' file, and collation field by using specially formatted comments directly in their code, facilitating easier maintenance and updates to documentation."
"rprojroot","2.1.1","Robust, reliable and flexible paths to files below
a project root. The 'root' of a project is defined as a directory that
matches a certain criterion, e.g., it contains a certain regular file.","This package provides robust and flexible methods for constructing file paths relative to a project root directory, identified by specific criteria, to enhance file management within R projects."
"rtables","0.6.13","Reporting tables often have structure that goes beyond simple
rectangular data. The 'rtables' package provides a framework for
declaring complex multi-level tabulations and then applying them to
data. This framework models both tabulation and the resulting tables
as hierarchical, tree-like objects which support sibling sub-tables,
arbitrary splitting or grouping of data in row and column dimensions,
cells containing multiple values, and the concept of contextual
summary computations. A convenient pipe-able interface is provided for
declaring table layouts and the corresponding computations, and then
applying them to data.","The 'rtables' package in R facilitates the creation of complex, hierarchical reporting tables with multi-level tabulations, enabling users to organize, summarize, and display data in a structured format while supporting advanced features like sibling sub-tables and contextual summaries."
"scales","1.4.0","Graphical scales map data to aesthetics, and provide methods
for automatically determining breaks and labels for axes and legends.","This package provides tools for mapping data to graphical aesthetics, along with automated methods for defining breaks and labels for axes and legends in visualizations."
"snakecase","0.11.1","A consistent, flexible and easy to use tool to parse and convert strings into cases like snake or camel among others.","This package provides a consistent and flexible tool for parsing and converting strings into various case formats, such as snake case and camel case."
"stringi","1.8.7","A collection of character string/text/natural language
processing tools for pattern searching (e.g., with 'Java'-like regular
expressions or the 'Unicode' collation algorithm), random string generation,
case mapping, string transliteration, concatenation, sorting, padding,
wrapping, Unicode normalisation, date-time formatting and parsing,
and many more. They are fast, consistent, convenient, and -
thanks to 'ICU' (International Components for Unicode) -
portable across all locales and platforms. Documentation about 'stringi' is
provided via its website at <https://stringi.gagolewski.com/> and
the paper by Gagolewski (2022, <doi:10.18637/jss.v103.i02>).","The `stringi` package provides a comprehensive set of tools for advanced string manipulation and processing, including pattern matching, string generation, case conversion, and Unicode handling, ensuring fast and consistent performance across various locales and platforms."
"stringr","1.6.0","A consistent, simple and easy to use set of wrappers around
the fantastic 'stringi' package. All function and argument names (and
positions) are consistent, all functions deal with ""NA""'s and zero
length vectors in the same way, and the output from one function is
easy to feed into the input of another.","This package provides a user-friendly interface with consistent naming and handling of inputs and outputs, streamlining string manipulation by wrapping around the powerful 'stringi' package."
"survival","3.8-3","Contains the core survival analysis routines, including
definition of Surv objects,
Kaplan-Meier and Aalen-Johansen (multi-state) curves, Cox models,
and parametric accelerated failure time models.","This package provides essential survival analysis functions, including the creation of survival objects, Kaplan-Meier and Aalen-Johansen curves, Cox regression models, and parametric accelerated failure time models."
"tibble","3.3.0","Provides a 'tbl_df' class (the 'tibble') with stricter checking and better formatting than the traditional
data frame.","The package provides a 'tbl_df' class, known as a 'tibble', which offers stricter data checking and improved formatting compared to traditional data frames in R."
"tidyr","1.3.1","Tools to help to create tidy data, where each column is a
variable, each row is an observation, and each cell contains a single
value.  'tidyr' contains tools for changing the shape (pivoting) and
hierarchy (nesting and 'unnesting') of a dataset, turning deeply
nested lists into rectangular data frames ('rectangling'), and
extracting values out of string columns. It also includes tools for
working with missing values (both implicit and explicit).","The 'tidyr' package provides tools for transforming and tidying data into a standardized format, allowing for efficient manipulation of datasets through operations such as pivoting, nesting, and handling missing values."
"tidyselect","1.2.1","A backend for the selecting functions of the 'tidyverse'.  It
makes it easy to implement select-like functions in your own packages
in a way that is consistent with other 'tidyverse' interfaces for
selection.","This package provides a backend that simplifies the implementation of select-like functions for custom packages, ensuring consistency with the selection interfaces of the 'tidyverse'."
"timechange","0.3.0","Efficient routines for manipulation of date-time objects while
accounting for time-zones and daylight saving times. The package includes
utilities for updating of date-time components (year, month, day etc.),
modification of time-zones, rounding of date-times, period addition and
subtraction etc. Parts of the 'CCTZ' source code, released under the Apache
2.0 License, are included in this package. See
<https://github.com/google/cctz> for more details.","This package provides efficient tools for manipulating date-time objects, including time-zone adjustments, daylight saving time handling, and various date-time modifications such as rounding and component updates."
"Tplyr","1.2.1","A traceability focused tool created to simplify the data manipulation necessary to create clinical summaries.","This package is designed to streamline the data manipulation processes required for generating clinical summaries with a focus on traceability."
"tzdb","0.5.0","Provides an up-to-date copy of the Internet Assigned Numbers
Authority (IANA) Time Zone Database. It is updated periodically to
reflect changes made by political bodies to time zone boundaries, UTC
offsets, and daylight saving time rules. Additionally, this package
provides a C++ interface for working with the 'date' library. 'date'
provides comprehensive support for working with dates and date-times,
which this package exposes to make it easier for other R packages to
utilize. Headers are provided for calendar specific calculations,
along with a limited interface for time zone manipulations.","This R package offers an updated copy of the IANA Time Zone Database along with a C++ interface for the 'date' library, facilitating comprehensive date and time management, including time zone manipulations and calendar calculations."
"utf8","1.2.6","Process and print 'UTF-8' encoded international
text (Unicode). Input, validate, normalize, encode, format, and
display.","This package facilitates the processing, validation, normalization, encoding, formatting, and display of UTF-8 encoded international text (Unicode)."
"V8","8.0.1","An R interface to V8 <https://v8.dev>: Google's open source JavaScript
and WebAssembly engine. This package can be compiled either with V8 or NodeJS
when built as a shared library.","This R package provides an interface to the V8 JavaScript engine, allowing users to execute JavaScript and WebAssembly code within R."
"vctrs","0.6.5","Defines new notions of prototype and size that are used to
provide tools for consistent and well-founded type-coercion and
size-recycling, and are in turn connected to ideas of type- and
size-stability useful for analysing function interfaces.","This package provides tools for consistent type coercion and size recycling through the definition of new prototype and size concepts, which facilitate the analysis of function interfaces with an emphasis on type and size stability."
"viridisLite","0.4.2","Color maps designed to improve graph readability for readers with
common forms of color blindness and/or color vision deficiency. The color
maps are also perceptually-uniform, both in regular form and also when
converted to black-and-white for printing. This is the 'lite' version of the
'viridis' package that also contains 'ggplot2' bindings for discrete and
continuous color and fill scales and can be found at
<https://cran.r-project.org/package=viridis>.","The 'viridisLite' package provides color maps designed for improved readability by individuals with color vision deficiencies, offering perceptually-uniform colors for both graphical and black-and-white printing applications, alongside 'ggplot2' bindings for color and fill scales."
"vroom","1.6.6","The goal of 'vroom' is to read and write data (like 'csv',
'tsv' and 'fwf') quickly. When reading it uses a quick initial
indexing step, then reads the values lazily , so only the data you
actually use needs to be read.  The writer formats the data in
parallel and writes to disk asynchronously from formatting.","The 'vroom' package is designed for fast reading and writing of data files such as CSV, TSV, and fixed-width formats, utilizing lazy loading to read only the necessary data and asynchronous writing for efficiency."
"withr","3.0.2","A set of functions to run code 'with' safely and temporarily
modified global state. Many of these functions were originally a part
of the 'devtools' package, this provides a simple package with limited
dependencies to provide access to these functions.","This package provides a set of functions that allow users to safely and temporarily modify the global state of R code during execution."
"xfun","0.54","Miscellaneous functions commonly used in other packages maintained by 'Yihui Xie'.","The package provides miscellaneous utility functions that are commonly utilized across various other packages maintained by Yihui Xie."
"xml2","1.4.1","Bindings to 'libxml2' for working with XML data using a simple,
consistent interface based on 'XPath' expressions. Also supports XML schema
validation; for 'XSLT' transformations see the 'xslt' package.","This package provides bindings to 'libxml2' for working with XML data using a straightforward interface based on 'XPath' expressions, along with support for XML schema validation."
"xportr","0.4.3","Tools to build CDISC compliant data sets and check for CDISC
compliance.","This package provides tools for constructing CDISC-compliant datasets and verifying their adherence to CDISC standards."
"yaml","2.3.10","Implements the 'libyaml' 'YAML' 1.1 parser and emitter
(<https://pyyaml.org/wiki/LibYAML>) for R.","This R package provides an interface to the 'libyaml' library for parsing and emitting YAML 1.1 data."
