"Package","Version","Description","description_btw"
"admiral","1.3.1","A toolbox for programming Clinical Data Interchange Standards
Consortium (CDISC) compliant Analysis Data Model (ADaM) datasets in R.
ADaM datasets are a mandatory part of any New Drug or Biologics
License Application submitted to the United States Food and Drug
Administration (FDA). Analysis derivations are implemented in
accordance with the ""Analysis Data Model Implementation Guide"" (CDISC
Analysis Data Model Team, 2021,
<https://www.cdisc.org/standards/foundational/adam>).","This R package provides tools for programming and creating Clinical Data Interchange Standards Consortium (CDISC) compliant Analysis Data Model (ADaM) datasets, essential for New Drug or Biologics License Applications to the FDA."
"admiraldev","1.3.1","Utility functions to check data, variables and conditions for
functions used in 'admiral' and 'admiral' extension packages.
Additional utility helper functions to assist developers with
maintaining documentation, testing and general upkeep of 'admiral' and
'admiral' extension packages.","The package provides utility functions for validating data, variables, and conditions in 'admiral' and its extension packages, along with developer tools for documentation and testing."
"assertthat","0.2.1","An extension to stopifnot() that makes it easy to declare
the pre and post conditions that you code should satisfy, while also
producing friendly error messages so that your users know what's gone
wrong.","This package enhances the functionality of stopifnot() by allowing users to easily declare pre and post conditions for their code, while providing user-friendly error messages to clarify any issues that arise."
"backports","1.5.0","Functions introduced or changed since R v3.0.0 are re-implemented in this
package. The backports are conditionally exported in order to let R resolve
the function name to either the implemented backport, or the respective base
version, if available. Package developers can make use of new functions or
arguments by selectively importing specific backports to
support older installations.","This package provides re-implementations of functions introduced or modified since R v3.0.0, allowing developers to utilize newer features while maintaining compatibility with older versions of R."
"base64enc","0.1-3","This package provides tools for handling base64 encoding. It is more flexible than the orphaned base64 package.","This package offers versatile tools for base64 encoding and decoding, providing a more flexible alternative to the deprecated base64 package."
"bit","4.6.0","Provided are classes for boolean and skewed boolean vectors,
fast boolean methods, fast unique and non-unique integer sorting,
fast set operations on sorted and unsorted sets of integers, and
foundations for ff (range index, compression, chunked processing).","This package offers optimized classes and methods for handling boolean and skewed boolean vectors, efficient integer sorting and set operations, as well as foundational tools for range indexing and data compression."
"bit64","4.6.0-1","Package 'bit64' provides serializable S3 atomic 64bit (signed) integers.
These are useful for handling database keys and exact counting in +-2^63.
WARNING: do not use them as replacement for 32bit integers, integer64 are not
supported for subscripting by R-core and they have different semantics when
combined with double, e.g. integer64 + double => integer64.
Class integer64 can be used in vectors, matrices, arrays and data.frames.
Methods are available for coercion from and to logicals, integers, doubles,
characters and factors as well as many elementwise and summary functions.
Many fast algorithmic operations such as 'match' and 'order' support inter-
active data exploration and manipulation and optionally leverage caching.","The 'bit64' package in R provides a way to handle serializable 64-bit signed integers, enabling precise management of large integers useful for database keys and exact counting operations, while supporting various data structures and coercion methods."
"brew","1.0-10","Implements a templating framework for mixing text and R code
for report generation. brew template syntax is similar to PHP, Ruby's
erb module, Java Server Pages, and Python's psp module.","This package implements a templating framework that allows users to combine text and R code for generating reports, using a syntax similar to popular web templating systems."
"broom","1.0.10","Summarizes key information about statistical objects in tidy
tibbles. This makes it easy to report results, create plots and
consistently work with large numbers of models at once.  Broom
provides three verbs that each provide different types of information
about a model. tidy() summarizes information about model components
such as coefficients of a regression. glance() reports information
about an entire model, such as goodness of fit measures like AIC and
BIC. augment() adds information about individual observations to a
dataset, such as fitted values or influence measures.","The Broom package in R transforms statistical model outputs into tidy data frames, allowing for easy summarization of model components, overall model statistics, and individual observation details for streamlined reporting and visualization."
"cachem","1.1.0","Key-value stores with automatic pruning. Caches can limit
either their total size or the age of the oldest object (or both),
automatically pruning objects to maintain the constraints.","This package provides key-value stores that automatically manage cache contents by pruning entries based on either their total size, their age, or both, ensuring efficient storage management."
"callr","3.7.6","It is sometimes useful to perform a computation in a separate
R process, without affecting the current R process at all.  This
packages does exactly that.","This package enables the execution of computations in a separate R process, ensuring that the current R session remains unaffected."
"cellranger","1.1.0","Helper functions to work with spreadsheets and the ""A1:D10"" style
of cell range specification.","This package provides helper functions for working with spreadsheets, specifically designed for handling the ""A1:D10"" style of cell range specification."
"checkmate","2.3.3","Tests and assertions to perform frequent argument checks. A
substantial part of the package was written in C to minimize any worries
about execution time overhead.","This package provides efficient argument validation through tests and assertions, with a significant portion implemented in C to reduce execution time overhead."
"cli","3.6.5","A suite of tools to build attractive command line interfaces
('CLIs'), from semantic elements: headings, lists, alerts, paragraphs,
etc. Supports custom themes via a 'CSS'-like language. It also
contains a number of lower level 'CLI' elements: rules, boxes, trees,
and 'Unicode' symbols with 'ASCII' alternatives. It support ANSI
colors and text styles as well.","This package offers a comprehensive suite of tools for creating visually appealing command line interfaces (CLIs) with semantic elements, customizable themes, and support for ANSI colors and various text styles."
"clipr","0.8.0","Simple utility functions to read from and write to
the Windows, OS X, and X11 clipboards.","This package provides simple utility functions for reading from and writing to the clipboard across Windows, OS X, and X11 environments."
"commonmark","2.0.0","The CommonMark specification <https://github.github.com/gfm/> defines
a rationalized version of markdown syntax. This package uses the 'cmark'
reference implementation for converting markdown text into various formats
including html, latex and groff man. In addition it exposes the markdown
parse tree in xml format. Also includes opt-in support for GFM extensions
including tables, autolinks, and strikethrough text.","This R package utilizes the 'cmark' implementation to convert CommonMark-compliant markdown text into various formats such as HTML, LaTeX, and groff man, while also offering an XML representation of the markdown parse tree and support for GitHub Flavored Markdown (GFM) extensions."
"cowplot","1.2.0","Provides various features that help with creating publication-quality figures
with 'ggplot2', such as a set of themes, functions to align plots and arrange
them into complex compound figures, and functions that make it easy to annotate
plots and or mix plots with images. The package was originally written for
internal use in the Wilke lab, hence the name (Claus O. Wilke's plot package).
It has also been used extensively in the book Fundamentals of Data
Visualization.","This package offers tools for creating publication-quality figures with 'ggplot2', including themes, alignment functions, and annotation capabilities, while facilitating the integration of complex compound figures and images."
"cpp11","0.5.2","Provides a header only, C++11 interface to R's C
interface.  Compared to other approaches 'cpp11' strives to be safe
against long jumps from the C API as well as C++ exceptions, conform
to normal R function semantics and supports interaction with 'ALTREP'
vectors.","The 'cpp11' package offers a safe and modern C++11 interface for interacting with R's C API, ensuring compatibility with R's function semantics and supporting ALTREP vectors."
"crayon","1.5.3","The crayon package is now superseded. Please use the 'cli'
package for new projects.  Colored terminal output on terminals that
support 'ANSI' color and highlight codes. It also works in 'Emacs'
'ESS'. 'ANSI' color support is automatically detected. Colors and
highlighting can be combined and nested. New styles can also be
created easily.  This package was inspired by the 'chalk' 'JavaScript'
project.","The crayon package enables colored terminal output with support for ANSI color codes, allowing for the creation and combination of customizable styles, and is compatible with environments like Emacs ESS."
"curl","7.0.0","Bindings to 'libcurl' <https://curl.se/libcurl/> for performing fully
configurable HTTP/FTP requests where responses can be processed in memory, on
disk, or streaming via the callback or connection interfaces. Some knowledge
of 'libcurl' is recommended; for a more-user-friendly web client see the
'httr2' package which builds on this package with http specific tools and logic.","This package provides bindings to 'libcurl' for performing customizable HTTP/FTP requests, allowing responses to be managed in memory, on disk, or streamed, while also recommending the 'httr2' package for a more user-friendly interface."
"datasetjson","0.3.0","Read, construct and write CDISC (Clinical Data Interchange Standards Consortium) Dataset JSON (JavaScript Object Notation) files, while validating per the Dataset JSON schema file, as described in CDISC (2023) <https://www.cdisc.org/standards/data-exchange/dataset-json>.","This package facilitates the reading, construction, and writing of CDISC Dataset JSON files while ensuring compliance with the Dataset JSON schema for validation purposes."
"desc","1.4.3","Tools to read, write, create, and manipulate DESCRIPTION
files.  It is intended for packages that create or manipulate other
packages.","This package provides tools for reading, writing, creating, and manipulating DESCRIPTION files, facilitating the management of R packages."
"diffdf","1.1.2","Functions for comparing two data.frames against
each other. The core functionality is to provide a detailed breakdown of any differences
between two data.frames as well as providing utility functions to help narrow down the
source of problems and differences.","This package offers functions to compare two data.frames in R, delivering a detailed analysis of their differences and providing utilities to diagnose discrepancies."
"digest","0.6.37","Implementation of a function 'digest()' for the creation of hash
digests of arbitrary R objects (using the 'md5', 'sha-1', 'sha-256', 'crc32',
'xxhash', 'murmurhash', 'spookyhash', 'blake3', 'crc32c', 'xxh3_64', and 'xxh3_128'
algorithms) permitting easy comparison of R language objects, as well as functions
such as'hmac()' to create hash-based message authentication code. Please note that
this package is not meant to be deployed for cryptographic purposes for which more
comprehensive (and widely tested) libraries such as 'OpenSSL' should be used.","This R package provides a function for creating hash digests of various R objects using multiple algorithms, along with an HMAC function for generating hash-based message authentication codes, but is not intended for cryptographic use."
"dplyr","1.1.4","A fast, consistent tool for working with data frame like
objects, both in memory and out of memory.","This package provides a fast and reliable framework for efficiently handling data frame-like objects, both in memory and when working with larger datasets that exceed memory limits."
"emmeans","2.0.0","Obtain estimated marginal means (EMMs) for many linear, generalized
linear, and mixed models. Compute contrasts or linear functions of EMMs,
trends, and comparisons of slopes. Plots and other displays.
Least-squares means are discussed, and the term ""estimated marginal means""
is suggested, in Searle, Speed, and Milliken (1980) Population marginal means
in the linear model: An alternative to least squares means, The American
Statistician 34(4), 216-221 <doi:10.1080/00031305.1980.10483031>.","This package provides tools to obtain estimated marginal means (EMMs) for various statistical models, enabling the computation of contrasts, trends, and comparisons, along with visualization options."
"estimability","1.5.1","Provides tools for determining estimability of linear functions
of regression coefficients, and 'epredict' methods that handle
non-estimable cases correctly. Estimability theory is discussed in
many linear-models textbooks including Chapter 3 of Monahan, JF (2008),
""A Primer on Linear Models"", Chapman and Hall (ISBN 978-1-4200-6201-4).","This R package provides tools to assess the estimability of linear functions of regression coefficients and includes methods for correctly handling cases that are non-estimable."
"evaluate","1.0.5","Parsing and evaluation tools that make it easy to recreate
the command line behaviour of R.","This package provides tools for parsing and evaluating R expressions, facilitating the recreation of command line behavior in R."
"fansi","1.0.6","Counterparts to R string manipulation functions that account for
the effects of ANSI text formatting control sequences.","This package provides functions for string manipulation in R that consider the impact of ANSI text formatting control sequences."
"farver","2.1.2","The encoding of colour can be handled in many different ways,
using different colour spaces. As different colour spaces have
different uses, efficient conversion between these representations are
important. The 'farver' package provides a set of functions that gives
access to very fast colour space conversion and comparisons
implemented in C++, and offers speed improvements over the
'convertColor' function in the 'grDevices' package.","The 'farver' package enables fast and efficient conversion and comparison between various colour spaces, offering performance enhancements over the 'convertColor' function in R's 'grDevices' package through its C++ implementation."
"fastmap","1.2.0","Fast implementation of data structures, including a key-value
store, stack, and queue. Environments are commonly used as key-value stores
in R, but every time a new key is used, it is added to R's global symbol
table, causing a small amount of memory leakage. This can be problematic in
cases where many different keys are used. Fastmap avoids this memory leak
issue by implementing the map using data structures in C++.","The Fastmap package provides efficient data structures for key-value storage, stacks, and queues in R, while avoiding memory leaks associated with traditional key-value store implementations."
"forcats","1.0.1","Helpers for reordering factor levels (including moving
specified levels to front, ordering by first appearance, reversing,
and randomly shuffling), and tools for modifying factor levels
(including collapsing rare levels into other, 'anonymising', and
manually 'recoding').","This package provides tools for reordering factor levels in R, allowing users to move specific levels to the front, order by first appearance, reverse the order, randomly shuffle levels, and modify factor levels through collapsing, anonymizing, and manual recoding."
"formatters","0.5.11","We provide a framework for rendering complex tables to ASCII,
and a set of formatters for transforming values or sets of values into
ASCII-ready display strings.","This package offers a framework for creating complex ASCII tables and includes various formatters to convert values into display-ready strings."
"fs","1.6.6","A cross-platform interface to file system operations, built
on top of the 'libuv' C library.","This package provides a cross-platform interface for file system operations, leveraging the capabilities of the 'libuv' C library."
"generics","0.1.4","In order to reduce potential package dependencies and
conflicts, generics provides a number of commonly used S3 generics.","The `generics` package in R provides a set of commonly used S3 generics to minimize package dependencies and conflicts."
"ggplot2","4.0.0","A system for 'declaratively' creating graphics, based on ""The
Grammar of Graphics"". You provide the data, tell 'ggplot2' how to map
variables to aesthetics, what graphical primitives to use, and it
takes care of the details.","'ggplot2' is a powerful R package that enables users to create complex visualizations by declaratively mapping data to aesthetic properties based on the principles of the Grammar of Graphics."
"ggsurvfit","1.2.0","Ease the creation of time-to-event (i.e. survival) endpoint
figures. The modular functions create figures ready for publication.
Each of the functions that add to or modify the figure are written as
proper 'ggplot2' geoms or stat methods, allowing the functions from
this package to be combined with any function or customization from
'ggplot2' and other 'ggplot2' extension packages.","This package facilitates the creation of publication-ready time-to-event (survival) endpoint figures using modular functions that integrate seamlessly with 'ggplot2' for enhanced customization and visual appeal."
"glue","1.8.0","An implementation of interpreted string literals, inspired by
Python's Literal String Interpolation
<https://www.python.org/dev/peps/pep-0498/> and Docstrings
<https://www.python.org/dev/peps/pep-0257/> and Julia's Triple-Quoted
String Literals
<https://docs.julialang.org/en/v1.3/manual/strings/#Triple-Quoted-String-Literals-1>.","This R package provides an implementation of interpreted string literals that allows for multiline string formatting and interpolation, drawing inspiration from Python and Julia's string handling features."
"gtable","0.3.6","Tools to make it easier to work with ""tables"" of 'grobs'. The
'gtable' package defines a 'gtable' grob class that specifies a grid
along with a list of grobs and their placement in the grid. Further
the package makes it easy to manipulate and combine 'gtable' objects
so that complex compositions can be built up sequentially.","The 'gtable' package provides tools for creating and manipulating table-like structures of graphical objects ('grobs'), allowing users to define grids and manage the placement of these objects for complex visual compositions."
"haven","2.5.5","Import foreign statistical formats into R via the embedded
'ReadStat' C library, <https://github.com/WizardMac/ReadStat>.","The package allows users to import various foreign statistical data formats into R using the integrated ReadStat C library."
"highr","0.11","Provides syntax highlighting for R source code. Currently it
supports LaTeX and HTML output. Source code of other languages is supported
via Andre Simon's highlight package (<https://gitlab.com/saalen/highlight>).","This package provides syntax highlighting for R source code in LaTeX and HTML formats, with support for additional languages through Andre Simon's highlight package."
"hms","1.1.4","Implements an S3 class for storing and formatting time-of-day
values, based on the 'difftime' class.","This package implements an S3 class designed for storing and formatting time-of-day values, utilizing the existing 'difftime' class for handling time differences."
"htmltools","0.5.8.1","Tools for HTML generation and output.","This package provides tools for generating and outputting HTML content efficiently."
"huxtable","5.7.0","Creates styled tables for data presentation. Export to HTML, LaTeX,
RTF, 'Word', 'Excel', and 'PowerPoint'. Simple, modern interface to manipulate
borders, size, position, captions, colours, text styles and number formatting.
Table cells can span multiple rows and/or columns.
Includes  a 'huxreg' function for creation of regression tables, and 'quick_*'
one-liners to print data to a new document.","This package facilitates the creation of styled tables for data presentation, allowing exports to various formats such as HTML, LaTeX, RTF, Word, Excel, and PowerPoint, with features for customizing borders, size, colors, text styles, and more."
"isoband","0.2.7","A fast C++ implementation to generate contour lines
(isolines) and contour polygons (isobands) from regularly spaced grids
containing elevation data.","This package provides a fast C++ implementation for generating contour lines (isolines) and contour polygons (isobands) from regularly spaced elevation data grids."
"janitor","2.2.1","The main janitor functions can: perfectly format data.frame column
names; provide quick counts of variable combinations (i.e., frequency
tables and crosstabs); and explore duplicate records. Other janitor functions
nicely format the tabulation results. These tabulate-and-report functions
approximate popular features of SPSS and Microsoft Excel. This package
follows the principles of the ""tidyverse"" and works well with the pipe function
%>%. janitor was built with beginning-to-intermediate R users in mind and is
optimized for user-friendliness.","The janitor package in R offers user-friendly functions for formatting data frame column names, generating frequency tables and crosstabs, and exploring duplicate records, all while embracing the principles of the tidyverse."
"jsonlite","2.0.0","A reasonably fast JSON parser and generator, optimized for statistical
data and the web. Offers simple, flexible tools for working with JSON in R, and
is particularly powerful for building pipelines and interacting with a web API.
The implementation is based on the mapping described in the vignette (Ooms, 2014).
In addition to converting JSON data from/to R objects, 'jsonlite' contains
functions to stream, validate, and prettify JSON data. The unit tests included
with the package verify that all edge cases are encoded and decoded consistently
for use with dynamic data in systems and applications.","The 'jsonlite' package in R provides efficient tools for parsing and generating JSON data, facilitating streamlined interactions with web APIs and the manipulation of statistical data."
"jsonvalidate","1.5.0","Uses the node library 'is-my-json-valid' or 'ajv' to
validate 'JSON' against a 'JSON' schema.  Drafts 04, 06 and 07 of
'JSON' schema are supported.","This package validates JSON data against a JSON schema using the 'is-my-json-valid' or 'ajv' Node libraries, supporting schema drafts 04, 06, and 07."
"knitr","1.50","Provides a general-purpose tool for dynamic report generation in R
using Literate Programming techniques.","This package offers a versatile tool for generating dynamic reports in R by employing Literate Programming techniques."
"labeling","0.4.3","Functions which provide a range of axis labeling algorithms.","This package offers a variety of algorithms for axis labeling in data visualizations."
"lattice","0.22-7","A powerful and elegant high-level data visualization
system inspired by Trellis graphics, with an emphasis on
multivariate data. Lattice is sufficient for typical graphics needs,
and is also flexible enough to handle most nonstandard requirements.
See ?Lattice for an introduction.","The Lattice package in R provides a high-level data visualization system designed for creating intricate and customizable multivariate graphs, inspired by Trellis graphics."
"lifecycle","1.0.4","Manage the life cycle of your exported functions with shared
conventions, documentation badges, and user-friendly deprecation
warnings.","This package facilitates the management of exported function life cycles by providing shared conventions, documentation badges, and user-friendly deprecation warnings."
"lubridate","1.9.4","Functions to work with date-times and time-spans: fast and
user friendly parsing of date-time data, extraction and updating of
components of a date-time (years, months, days, hours, minutes, and
seconds), algebraic manipulation on date-time and time-span objects.
The 'lubridate' package has a consistent and memorable syntax that
makes working with dates easy and fun.","The 'lubridate' package in R offers user-friendly tools for parsing, manipulating, and performing arithmetic on date-time and time-span objects, making date handling intuitive and efficient."
